{"benchmark":{"developmentCases":true,"implementationSha256":"d425fb3a83e22735d2055ac541bbbeef11dd582bf6ec15b798c5321430a1a9fe","name":"MarginBench","taskSet":"public-development-v1","version":"0.1.0"},"candidate":{"id":"single-read-handoff-guidance-v3","manualSha256":"5739e8e4f6da78091d14589f6674fd2928216b1199ea9e523a7073a8cd34909f","marginSha256":"c220c0d61de8d523a2d55e1226693acda7ee909e2d518cc25572737965d2c57e","settingsSha256":"7aa114edc53f904a5cc7e77cb24b0d133a2d5fab1ede1f009cb672cb20aab6d5"},"cost":{"admissionBound":1.82136,"boundBasis":{"billingOverheadUSDPerCall":0.0002,"inputPricePerMillion":0.03,"inputTokenCeilingPerCall":1000000,"modelCallsPerAgentAtMost":10,"outputPricePerMillion":0.13,"outputTokenCeilingPerCall":1200,"upstreamAttemptsPerTurnAtMost":3},"currency":"USD","hardAdmissionCap":2.0,"observedWalletDebit":0.0039,"traceReported":0.0039,"unreconciled":0.0},"episodes":[{"checks":{"all_expected_annotations":true,"all_or_none":true,"attribution":true,"committed_all":true,"duplicate_free":true,"minimum_annotations":true,"no_unexpected_annotations":true,"required_commands":false,"required_recovery_observed":true,"source_expected":true,"valid_command_use":true,"valid_documents":true,"workspace_policy":true},"commandCount":14,"dimensions":{"efficiency":100.0,"integrity":100.0,"outcome":100.0,"protocol":75.0,"recovery":100.0},"durationMs":68540.87,"fingerprint":"3b9f1593fa6a6347148ebcf4fc20e4570519c18781722e6990e12fe2f7c22b5f","id":"directory_handoff:0:3b9f1593fa6a","invalidCommandCount":0,"marginSha256":"c220c0d61de8d523a2d55e1226693acda7ee909e2d518cc25572737965d2c57e","repetition":0,"safetyPassed":true,"scenario":"directory_handoff","score":96.25,"sourcePreserved":true,"stopConditions":[{"count":2,"name":"agent_completed"}],"usage":{"cachedInputTokens":57728,"completionTokens":6365,"modelCalls":16,"promptTokens":82309,"reasoningTokens":4521,"reportedCostUSD":0.0039}}],"execution":{"adapter":"prime-verifiers-v1","agentProcessCount":2,"controlProfile":"role-separated-margin-only-v1","durationMs":71302,"harness":"null-with-one-margin-tool","limits":{"billingOverheadUSDPerCall":0.0002,"inputTokenCeilingPerCall":1000000,"maxConcurrentEpisodes":1,"maxInputTokens":40000,"maxOutputTokens":6000,"maxTokensPerCall":1200,"maxTotalTokens":16000,"maxTurns":10,"rolloutTimeoutSeconds":120.0,"temperature":0.0,"upstreamAttemptsPerTurn":3},"model":"qwen/qwen3.7-flash","priorInfrastructureAttempts":0,"provider":"Prime Intellect","retryPolicy":"No automatic paid model retries; later attempts are separate capped runs after cooldown.","roles":["author","reviewer"],"runtime":"local-subprocess-environment-with-prime-inference","startedAt":"2026-08-18T08:49:03Z"},"privacy":{"credentialsPresent":false,"holdoutKeyPublished":false,"promptsPublished":false,"rawTracesPublished":false},"runID":"54d4d3e13f8aff61c4a05b249fe0156c","schema":"urn:marginbench:run:v1","status":"completed","track":"interface"}
