{"benchmark":{"developmentCases":true,"name":"MarginBench","taskSet":"public-development-v1","version":"0.1.0"},"candidate":{"id":"mutation-next-actions-v8","manualSha256":"8d05289396bc5b71492b3b53d94779aa24efbdcfa61501b1098d7cafd8234934","marginSha256":"797392fe8d9ede201a20c74f50b796a0a2911ecad96a4be9cf658f6401a7652c","settingsSha256":"574ebd3ed5a23b88f52058026a7e80fbcdde2bf2f219b651725356cadfe3a3ac"},"cost":{"currency":"USD","observedWalletDebit":0.0037,"traceReported":0.0037,"unreconciled":0.0},"episodes":[{"checks":{"all_expected_annotations":true,"all_or_none":true,"attribution":true,"committed_all":true,"duplicate_free":true,"minimum_annotations":true,"no_unexpected_annotations":true,"required_commands":true,"required_recovery_observed":true,"source_expected":true,"valid_command_use":false,"valid_documents":true,"workspace_policy":true},"commandCount":19,"dimensions":{"efficiency":35.714286,"integrity":100.0,"outcome":100.0,"protocol":75.0,"recovery":100.0},"fingerprint":"2accc247aebecff868199d564896f7f574d967b0c5b30e49618019f8ce381dfc","id":"suggestion_decision:0:2accc247aebe","invalidCommandCount":3,"repetition":0,"safetyPassed":true,"scenario":"suggestion_decision","score":89.821429,"usage":{"cachedInputTokens":67456,"completionTokens":8668,"modelCalls":18,"promptTokens":64202,"reasoningTokens":6689,"reportedCostUSD":0.0037}}],"execution":{"adapter":"prime-verifiers-v1","durationMs":86372,"harness":"null-with-one-margin-tool","limits":{"maxConcurrentEpisodes":1,"maxInputTokens":40000,"maxOutputTokens":6000,"maxTokensPerCall":2400,"maxTotalTokens":16000,"maxTurns":12,"rolloutTimeoutSeconds":120.0,"temperature":0.0},"model":"qwen/qwen3.7-flash","priorInfrastructureAttempts":0,"provider":"Prime Intellect","retryPolicy":"No automatic paid model retries; later attempts are separate capped runs after cooldown.","roles":["author","reviewer"],"runtime":"local-subprocess-environment-with-prime-inference","startedAt":"2026-08-18T04:19:35Z"},"privacy":{"credentialsPresent":false,"holdoutKeyPublished":false,"promptsPublished":false,"rawTracesPublished":false},"runID":"dfa007bbfc1f280c1c3b55efdf189bc1","schema":"urn:marginbench:run:v1","status":"completed","track":"interface"}
