{"benchmark":{"developmentCases":true,"name":"MarginBench","taskSet":"public-development-v1","version":"0.1.0"},"candidate":{"id":"fair-sampling-window-v6","manualSha256":"0b2572571c65ac3afeff99d5ee888f904c3f94be622b0be3b8cabf9b1e75083b","marginSha256":"6dc5c6cc57594371d37c2a134564280511dc763fb2fedab036b29b0b2df5395d","settingsSha256":"c0da840ce332deb8390e8000c901cde45f367da685f8bd281530588cc6abe23c"},"cost":{"currency":"USD","observedWalletDebit":0.0028,"traceReported":0.0028,"unreconciled":0.0},"episodes":[{"checks":{"all_expected_annotations":false,"all_or_none":true,"attribution":true,"committed_all":true,"duplicate_free":true,"minimum_annotations":true,"no_unexpected_annotations":true,"required_commands":true,"required_recovery_observed":true,"source_expected":true,"valid_command_use":false,"valid_documents":true,"workspace_policy":true},"commandCount":17,"dimensions":{"efficiency":100.0,"integrity":100.0,"outcome":75.0,"protocol":75.0,"recovery":100.0},"fingerprint":"9117b49e318eccfb03a225cd3c3e225fb4080418b78384e4301317fc03af0113","id":"concurrent_review:0:9117b49e318e","invalidCommandCount":1,"repetition":0,"safetyPassed":true,"scenario":"concurrent_review","score":85.0,"usage":{"cachedInputTokens":37504,"completionTokens":3812,"modelCalls":19,"promptTokens":65013,"reasoningTokens":2585,"reportedCostUSD":0.0028}}],"execution":{"adapter":"prime-verifiers-v1","durationMs":32483,"harness":"null-with-one-margin-tool","limits":{"maxConcurrentEpisodes":1,"maxInputTokens":40000,"maxOutputTokens":6000,"maxTokensPerCall":2400,"maxTotalTokens":16000,"maxTurns":12,"rolloutTimeoutSeconds":120.0,"temperature":0.0},"model":"qwen/qwen3.7-flash","priorInfrastructureAttempts":0,"provider":"Prime Intellect","retryPolicy":"No automatic paid model retries; later attempts are separate capped runs after cooldown.","roles":["author","reviewer"],"runtime":"local-subprocess-environment-with-prime-inference","startedAt":"2026-08-18T04:09:17Z"},"privacy":{"credentialsPresent":false,"holdoutKeyPublished":false,"promptsPublished":false,"rawTracesPublished":false},"runID":"257c5492dcde995cf0f379c7c4653d80","schema":"urn:marginbench:run:v1","status":"completed","track":"interface"}
