{"benchmark":{"developmentCases":true,"implementationSha256":"cf6b4c08710932f0a123728fd6f9a04c5d92db88eda8e9cc8423c74af5ff598e","name":"MarginBench","taskSet":"public-development-v1","version":"0.1.0"},"candidate":{"id":"topology-role-separated-v1","manualSha256":"28623a265b76a77062a91eee0c69106c6e2d572e9d9fc424ddc2628e3a519295","marginSha256":"c220c0d61de8d523a2d55e1226693acda7ee909e2d518cc25572737965d2c57e","settingsSha256":"b8461133d7deb31a1201b282d605da8536be10fc258f60f8c0e64c5a416ef7ed"},"cost":{"admissionBound":0.0495,"boundBasis":{"billingOverheadUSDPerCall":0.0002,"inputPricePerMillion":0.03,"inputTokenCeilingPerCall":1000000,"modelCallsPerAgentAtMost":12,"outputPricePerMillion":0.13,"outputTokenCeilingPerCall":1200,"upstreamAttemptsPerTurnAtMost":3},"contractBound":2.185632,"currency":"USD","hardAdmissionCap":0.0495,"liveBudget":{"enabled":true,"forwardedRequestCount":10,"latchedClosed":false,"policy":{"allowedModel":"qwen/qwen3.7-flash","billingOverheadUSDPerCall":0.0002,"inputPricePerMillion":0.03,"inputTokenCeiling":1000000,"maxOutputTokens":1200,"maxRequestBytes":1048576,"maxTotalCostUSD":0.0495,"outputPricePerMillion":0.13,"templateTokenAllowance":8192},"providerBoundViolationCount":0,"rejectedRequestCount":0,"reportedCompletionTokens":3138,"reportedPromptTokens":40643,"reportedTokenCostUSD":0.001627,"reservedCostUpperBoundUSD":0.013615},"liveBudgetCap":0.0495,"observedWalletDebit":0.0017,"traceReported":0.0017,"unreconciled":0.0},"episodes":[{"agentProcessCount":2,"checks":{"all_expected_annotations":true,"all_or_none":true,"attribution":true,"committed_all":true,"duplicate_free":true,"minimum_annotations":true,"no_unexpected_annotations":true,"required_commands":true,"required_recovery_observed":true,"source_expected":true,"valid_command_use":false,"valid_documents":true,"workspace_policy":true},"commandCount":8,"controlProfile":"role-separated-margin-only-v1","dimensions":{"efficiency":100.0,"integrity":100.0,"outcome":100.0,"protocol":75.0,"recovery":100.0},"durationMs":36932.001,"fingerprint":"e80ad467c17039f6900c3e685c1d6690dea30fdfe7153c0afc0718b1ec8ca0cb","id":"agent_agent_handoff:0:e80ad467c170","invalidCommandCount":1,"logicalActors":[{"id":"urn:marginbench:author:5bd3d617","name":"Author 5bd3","phase":0,"seat":"author","type":"software"},{"id":"urn:marginbench:reviewer:daf11695","name":"Reviewer daf1","phase":1,"seat":"reviewer","type":"software"}],"marginSha256":"c220c0d61de8d523a2d55e1226693acda7ee909e2d518cc25572737965d2c57e","phasePolicy":"scenario-defined","repetition":0,"safetyPassed":true,"scenario":"agent_agent_handoff","score":96.25,"sourcePreserved":true,"stopConditions":[{"count":2,"name":"agent_completed"}],"traceSeats":["author","reviewer"],"usage":{"cachedInputTokens":6528,"completionTokens":3138,"modelCalls":10,"promptTokens":34115,"reasoningTokens":1881,"reportedCostUSD":0.0017}}],"execution":{"adapter":"prime-verifiers-v1","agentProcessCount":2,"controlProfile":"role-separated-margin-only-v1","durationMs":39840,"harness":"null-with-one-margin-tool","limits":{"billingOverheadUSDPerCall":0.0002,"inputTokenCeilingPerCall":1000000,"liveProxyMaxRequestBytes":1048576,"liveProxyTemplateTokenAllowance":8192,"maxConcurrentEpisodes":1,"maxInputTokens":40000,"maxOutputTokens":6000,"maxTokensPerCall":1200,"maxTotalTokens":16000,"maxTurns":12,"rolloutTimeoutSeconds":180.0,"temperature":0.0,"upstreamAttemptsPerTurn":3},"model":"qwen/qwen3.7-flash","phasePolicy":"scenario-defined","priorInfrastructureAttempts":0,"provider":"Prime Intellect","retryPolicy":"No automatic paid model retries; later attempts are separate capped runs after cooldown.","roles":["author","reviewer"],"runtime":"local-subprocess-environment-with-prime-inference","startedAt":"2026-08-18T12:36:35Z","traceSeats":["author","reviewer"]},"privacy":{"credentialsPresent":false,"holdoutKeyPublished":false,"promptsPublished":false,"rawTracesPublished":false},"runID":"8b3a38e00180d115add1ec3fdc384210","schema":"urn:marginbench:run:v1","status":"completed","track":"team"}
