{"benchmark":{"developmentCases":true,"implementationSha256":"4a483622dbf35ebe798385b4b711bd6d0b09349e115b33cd41e2134666a90504","name":"MarginBench","taskSet":"public-development-v1","version":"0.1.0"},"candidate":{"id":"live-budget-proxy-smoke-v1","manualSha256":"28623a265b76a77062a91eee0c69106c6e2d572e9d9fc424ddc2628e3a519295","marginSha256":"c220c0d61de8d523a2d55e1226693acda7ee909e2d518cc25572737965d2c57e","settingsSha256":"6687ad26e107e222aad113f83d4051ccd4dd488da6f4c4b766cc82a00c34fac5"},"cost":{"admissionBound":0.02,"boundBasis":{"billingOverheadUSDPerCall":0.0002,"inputPricePerMillion":0.03,"inputTokenCeilingPerCall":1000000,"modelCallsPerAgentAtMost":6,"outputPricePerMillion":0.13,"outputTokenCeilingPerCall":800,"upstreamAttemptsPerTurnAtMost":1},"contractBound":0.181824,"currency":"USD","hardAdmissionCap":0.02,"liveBudget":{"enabled":true,"forwardedRequestCount":6,"policy":{"allowedModel":"qwen/qwen3.7-flash","billingOverheadUSDPerCall":0.0002,"inputPricePerMillion":0.03,"inputTokenCeiling":1000000,"maxOutputTokens":800,"maxRequestBytes":1048576,"maxTotalCostUSD":0.02,"outputPricePerMillion":0.13,"templateTokenAllowance":8192},"rejectedRequestCount":0,"reportedCompletionTokens":2168,"reportedPromptTokens":26070,"reportedTokenCostUSD":0.001064,"reservedCostUpperBoundUSD":0.008847},"liveBudgetCap":0.02,"observedWalletDebit":0.001,"traceReported":0.001,"unreconciled":0.0},"episodes":[{"checks":{"all_expected_annotations":true,"all_or_none":true,"attribution":true,"committed_all":true,"duplicate_free":true,"minimum_annotations":true,"no_unexpected_annotations":true,"required_commands":true,"required_recovery_observed":true,"source_expected":true,"valid_command_use":false,"valid_documents":true,"workspace_policy":true},"commandCount":5,"dimensions":{"efficiency":100.0,"integrity":100.0,"outcome":100.0,"protocol":75.0,"recovery":100.0},"durationMs":25300.117,"fingerprint":"815198a62d06eec81753fc13dd7c910e14e5da15f57ee46f5a5a83f21c148cd3","id":"human_agent_relay:0:815198a62d06","invalidCommandCount":1,"marginSha256":"c220c0d61de8d523a2d55e1226693acda7ee909e2d518cc25572737965d2c57e","repetition":0,"safetyPassed":true,"scenario":"human_agent_relay","score":96.25,"sourcePreserved":true,"stopConditions":[{"count":1,"name":"agent_completed"}],"usage":{"cachedInputTokens":4352,"completionTokens":2168,"modelCalls":6,"promptTokens":21718,"reasoningTokens":1219,"reportedCostUSD":0.001}}],"execution":{"adapter":"prime-verifiers-v1","agentProcessCount":1,"controlProfile":"role-separated-margin-only-v1","durationMs":28312,"harness":"null-with-one-margin-tool","limits":{"billingOverheadUSDPerCall":0.0002,"inputTokenCeilingPerCall":1000000,"liveProxyMaxRequestBytes":1048576,"liveProxyTemplateTokenAllowance":8192,"maxConcurrentEpisodes":1,"maxInputTokens":20000,"maxOutputTokens":4000,"maxTokensPerCall":800,"maxTotalTokens":8000,"maxTurns":6,"rolloutTimeoutSeconds":120.0,"temperature":0.0,"upstreamAttemptsPerTurn":1},"model":"qwen/qwen3.7-flash","priorInfrastructureAttempts":0,"provider":"Prime Intellect","retryPolicy":"No automatic paid model retries; later attempts are separate capped runs after cooldown.","roles":["reviewer"],"runtime":"local-subprocess-environment-with-prime-inference","startedAt":"2026-08-18T09:17:53Z"},"privacy":{"credentialsPresent":false,"holdoutKeyPublished":false,"promptsPublished":false,"rawTracesPublished":false},"runID":"721daaeaada10a455b7d9ceb28280678","schema":"urn:marginbench:run:v1","status":"completed","track":"interface"}
